<!--
  Copyright 2012 SURFnet bv, The Netherlands

  Licensed under the Apache License, Version 2.0 (the "License");
  you may not use this file except in compliance with the License.
  You may obtain a copy of the License at

       http://www.apache.org/licenses/LICENSE-2.0

  Unless required by applicable law or agreed to in writing, software
  distributed under the License is distributed on an "AS IS" BASIS,
  WITHOUT WARRANTIES OR CONDITIONS OF ANY KIND, either express or implied.
  See the License for the specific language governing permissions and
  limitations under the License.
  -->

<fed:Config xmlns:fed="http://www.surffederatie.nl/namespaces/fedcfg"
            xmlns:xsi="http://www.w3.org/2001/XMLSchema-instance"
            xsi:schemaLocation="http://www.surffederatie.nl/namespaces/fedcfg fedcfg.xsd">
  <fed:IdPs>
    <!--Zero or more repetitions:-->
    <fed:IdP id="idpidentity1" display="true" type="proxy">
      <fed:InstitutionID>string</fed:InstitutionID>
      <fed:Name>IdP Number one</fed:Name>
      <!--Optional:-->
      <fed:HomeURL>http://www.company.org/sonoras/aeoliam</fed:HomeURL>
      <!--Optional:-->
      <fed:LogoURL>http://www.any.com/verrantque/temperat</fed:LogoURL>
      <!--Optional:-->
      <fed:MetadataURL>http://www.any.com/circum/regemque</fed:MetadataURL>
      <!--Optional:-->
      <fed:SSOLocation>http://www.test.com/foedere/ferant</fed:SSOLocation>
      <!--Optional:-->
      <fed:SLOLocation>http://www.corp.org/et/turbine</fed:SLOLocation>
      <fed:ContactPersons>
        <!--Zero or more repetitions:-->
        <fed:ContactPerson contactType="help">
          <fed:Name>Mr Contact Person</fed:Name>
          <fed:EmailAddress>help@example.com</fed:EmailAddress>
          <!--Optional:-->
          <fed:TelephoneNumber>+31123456789</fed:TelephoneNumber>
        </fed:ContactPerson>
        <fed:ContactPerson contactType="administrative">
          <fed:Name>Mr Contact Person</fed:Name>
          <fed:EmailAddress>admin@example.com</fed:EmailAddress>
          <!--Optional:-->
          <fed:TelephoneNumber>+31123456789</fed:TelephoneNumber>
        </fed:ContactPerson>
      </fed:ContactPersons>
    </fed:IdP>
    <fed:IdP id="SURFnetGuests" display="true" type="saml20">
      <fed:InstitutionID>SURFnet</fed:InstitutionID>
      <fed:Name>SURFguest</fed:Name>
      <!--Optional:-->
      <fed:HomeURL>http://www.surfguest.nl</fed:HomeURL>
      <!--Optional:-->
      <fed:LogoURL>https://static.surfconext.nl/media/surfnet_logo.gif</fed:LogoURL>
      <fed:ContactPersons>
        <!--Zero or more repetitions:-->
        <fed:ContactPerson contactType="help">
          <fed:Name>B.E. Heerder</fed:Name>
          <fed:EmailAddress>b.e.heerder@example.com</fed:EmailAddress>
        </fed:ContactPerson>
      </fed:ContactPersons>
    </fed:IdP>
    <fed:IdP id="idpidentity2" display="true" type="proxy">
      <fed:InstitutionID>string</fed:InstitutionID>
      <fed:Name>IdP Number Two</fed:Name>
      <!--Optional:-->
      <fed:HomeURL>http://www.company.org/sonoras/aeoliam</fed:HomeURL>
      <!--Optional:-->
      <fed:LogoURL>http://www.any.com/verrantque/temperat</fed:LogoURL>
      <!--Optional:-->
      <fed:MetadataURL>http://www.any.com/circum/regemque</fed:MetadataURL>
      <!--Optional:-->
      <fed:SSOLocation>http://www.test.com/foedere/ferant</fed:SSOLocation>
      <!--Optional:-->
      <fed:SLOLocation>http://www.corp.org/et/turbine</fed:SLOLocation>
      <fed:ContactPersons>
        <!--Zero or more repetitions:-->
        <fed:ContactPerson contactType="help">
          <fed:Name>Contact Person</fed:Name>
          <fed:EmailAddress>contact@example.com</fed:EmailAddress>
          <!--Optional:-->
          <fed:TelephoneNumber>+3112121212</fed:TelephoneNumber>
        </fed:ContactPerson>
      </fed:ContactPersons>
    </fed:IdP>
  </fed:IdPs>
  <fed:SPs>
    <!--Zero or more repetitions:-->
    <fed:SP id="http://example.com/sp-entity-id" type="radius">
      <fed:Name>Dummy SURFfederatie Service Provider</fed:Name>
      <!--Optional:-->
      <fed:HomeURL>http://www.corp.gov/hoc/rapidum</fed:HomeURL>
      <!--Optional:-->
      <fed:LogoURL>https://static.surfconext.nl/media/surfnet_logo.gif</fed:LogoURL>
      <!--Optional:-->
      <fed:MetadataURL>http://www.any.gov/speluncis/circum</fed:MetadataURL>
      <fed:ContactPersons>
        <!--Zero or more repetitions:-->
        <fed:ContactPerson contactType="technical">
          <fed:Name>John Üñîçø∂é</fed:Name>
          <fed:EmailAddress>techsupport@example.com</fed:EmailAddress>
          <!--Optional:-->
          <fed:TelephoneNumber>+31123456123</fed:TelephoneNumber>
        </fed:ContactPerson>
      </fed:ContactPersons>
      <!--Optional:-->
      <fed:ACL>
        <!--Zero or more repetitions:-->
        <fed:IdPRef>idpentity1</fed:IdPRef>
        <fed:IdPRef>SURFnetGuests</fed:IdPRef>
      </fed:ACL>
      <!--Zero or more repetitions:-->
      <fed:ARP>
        <!--Zero or more repetitions:-->
        <fed:Attribute>uuid</fed:Attribute>
        <fed:Attribute>displayName</fed:Attribute>
      </fed:ARP>
    </fed:SP>
    <fed:SP id="string2" type="radius">
      <fed:Name>Dummy SURFfederatie Service Provider 2</fed:Name>
      <!--Optional:-->
      <fed:HomeURL>https://static.surfconext.nl/media/surfnet_logo.gif</fed:HomeURL>
      <!--Optional:-->
      <fed:LogoURL>http://www.corp.gov/hoc/rapidum</fed:LogoURL>
      <!--Optional:-->
      <fed:MetadataURL>http://www.any.gov/speluncis/circum</fed:MetadataURL>
      <fed:ContactPersons>
        <!--Zero or more repetitions:-->
        <fed:ContactPerson contactType="technical">
          <fed:Name>John Üñîçø∂é</fed:Name>
          <fed:EmailAddress>techsupport@example.com</fed:EmailAddress>
          <!--Optional:-->
          <fed:TelephoneNumber>+31123456123</fed:TelephoneNumber>
        </fed:ContactPerson>
      </fed:ContactPersons>
      <!--Optional:-->
      <fed:ACL>
        <!--Zero or more repetitions:-->
      </fed:ACL>
      <!--Zero or more repetitions:-->
      <fed:ARP idpid="idpidentity1">
        <!--Zero or more repetitions:-->
        <fed:Attribute>mailaddress</fed:Attribute>
      </fed:ARP>
    </fed:SP>
  </fed:SPs>
</fed:Config>